,紧急程度,问题汇总,问题汇总_jieba,jieba,0
0,重要,QuattroMicro仪器，今年6月份清洗过离子源，之后响应尚可，近期仪器响应不稳定，工程师上门维护一下，响应即能恢复，但实验人员平时维护后，响应又复下降，反复几次，怀疑仪器依然存在问题,QuattroMicro 仪器 今年 月份 清洗 离子源 之后 响应 尚可 近期 仪器 响应 稳定 工程师 上门 维护 一下 响应 即能 恢复 实验 人员 平时 维护 响应 复 下降 反复 几次 怀疑 仪器 依然 存在 问题 ,QuattroMicro 仪器 今年 月份 清洗 离子源 之后 响应 尚可 近期 仪器 响应 稳定 工程师 上门 维护 一下 响应 即能 恢复 实验 人员 平时 维护 响应 复 下降 反复 几次 怀疑 仪器 依然 存在 问题 QM . 第一天 上门 测试 复溶板 响应 - 8e5 图形 响应 均 表现 良好 . 测试 三块 板 次日 发现 前 几十个 样本 响应 图形 均 尚可 后面 样本 第二第三 板 图形 出现 明显 毛刺 最后 样本 响应 已经 下降 3e5 响应 无法 持续 . 更换 新 毛细管 效果 明显 依旧 毛刺 更换 超声 双通 Tip 头 依然 毛刺 （ 后面 发现 应该 毛细管 安装 到位 所致 ） . 调换 TQD 六通 阀 （ QM 通用 ） 更换 一段 peek 管路 图形 依旧 凹凸不平 . 甲酸 清洗 锥孔 超声 图形 依旧 . 清洗 四级 杆 碰撞 池 离子源 六级 杆 发现 四级 杆 组件 六颗 固定 螺丝 并未 旋紧 提出 发现 内部 碰撞 池 氩气 软管 外面 较脏 附着 颗粒状 灰尘 . 抽 真空 小时 达到 1.00 e - 测试 图形 毛刺 更为 厉害 进 peg 发现 峰型 跳动 很大 拆出 探头 发现 毛细管 可能 并未 旋 到位 略松 重新安装 测 peg 峰型 正常 测试 复溶板 图形 毛刺 明显好转 响应 不高 4e58 . 调近 probe 角度 萃取 锥孔 电压 改成 响应 上升 6e5 更换 成 TQD probe （ 二者 通用 ） 响应 升高 7e5 二者 相差不多 图形 略有 毛刺 以前 复溶 测试 图形 表现 一致 复溶 测试 两块 板 . 次日 查看 两块 板 测试 情况 响应 维持 图形 表现 正常 （ 依旧 略有 凹凸不平 ） TQD . 发现 MSMethod 中 Gly Ala 采集 质量数 75.6 93.8 偏差 进 PEG 发现 低端 质量数 偏离 严重 调用 之前 月份 Waters 进行 Intellistart 校正曲线 发现 Calibration 曲线 45.03 认错 导致 . 重新 TQD 进行 Intellistart 重新 进 内标 进行 MSMethod 调整 ,0.7521640652425603
1,重要,1235试剂仓移动故障。,1235 试剂仓 移动 故障 ,1235 试剂仓 移动 故障 . 用手 移动 试剂仓 阻力 很大 之前 老师 已经 上油过 取 试剂仓 检测 底部 并未 发现 底部 通明 垫片 损坏 脱落 重新 清洁 润滑 导轨 检查 固定 螺丝 并未 松动 进入 测试 模式 测试 正常 . 查看 历史记录 发现 17 号 PAPPA 条 稀释 微管 均 报 lossdetectedliquid 拆 稀释 微管 托盘 发现 底部 结晶 重新 清洁 干净 发现 加样针 位置 偏 对齐 重新 校正 稀释 微管 位置 稀释 微管 位置 液面 探测 正常 位置 正常 跟进 一次 实验 正常 观察 最近 实验 情况 ,0.7122148756628646
2,重要,邵阳妇幼gsp液体满溢故障gsp液体满溢故障,邵阳 妇幼 gsp 液体 满溢 故障 gsp 液体 满溢 故障 ,邵阳 妇幼 gsp 液体 满溢 故障 gsp 液体 满溢 故障 查看 log 故障 发生 洗板 模块 正在 工作 状态 检查 正 负压 系统 正常 排除 洗板 模块 满溢 可能性 检查 排除 模块 溢流 可能性 制冷 单元 工作 正常 大量 冷凝水 发现 V1 电磁阀 工作 间隔 短 不能 tank 水 清空 更换 HPR 控制板 ,0.6018072023105464
3,重要,客户反馈近期KM1软件使用过程中死机较频繁；经常软件死机软件经常在使用过程中死机,客户 反馈 近期 KM1 软件 使用 过程中 死机 频繁 经常 软件 死机 软件 经常 使用 过程中 死机 ,客户 反馈 近期 KM1 软件 使用 过程中 死机 频繁 经常 软件 死机 软件 经常 使用 过程中 死机 考虑 死机 次数 频繁 怀疑 操作系统 问题 备份 目前 XP 系统 安装 win732 位 系统 SP1 补丁 系统 激活 安装 CV 软件 SQL 数据库 驱动 装完 采集卡 驱动 连接 摄像头 电脑 蓝屏 尝试 不同 版本 SL 图库 采集卡 驱动 没有 效果 怀疑 win7 系统 兼容 考虑 近期 出现 经常 死机 问题 系统 恢复 备份 系统 ,0.7402370106788217
4,重要,扫描结果信号强度值偏低，需要对扫描仪进行校准,扫描 信号强度 值 偏低 需要 扫描仪 进行 校准 ,扫描 信号强度 值 偏低 需要 扫描仪 进行 校准 清洁 反光镜 滤光片 进行 光 路 校准 执行 FCD 测试通过 校准 Linearity Arcradius GAIN 扫描 两张 旧 芯片 信号强度 值有 明显 提升 ,0.5138382446279679
5,重要,扫描仪运行对温度较敏感；！！装机还未完成，客户不知道该故障，建议不要回访！！问题:1.芯片扫描仪对温度敏感，上周更换PDPsensor后问题依旧。问题:1.芯片扫描仪对温度敏感，上周更换PDPsensor后问题依旧。重新刷写DOCFLASH卡后无法联机，系统指示灯同时闪黄灯。将DOC寄给昂飞，用刷写器重新刷写。,扫描仪 运行 温度 敏感 装机 未 完成 客户 知道 故障 建议 不要 回访 问题 : . 芯片 扫描仪 温度 敏感 上周 更换 PDPsensor 问题 依旧 问题 : . 芯片 扫描仪 温度 敏感 上周 更换 PDPsensor 问题 依旧 重新 刷写 DOCFLASH 卡后 无法 联机 系统 指示灯 闪 黄灯 DOC 寄给 昂飞 刷写 器 重新 刷写 ,扫描仪 运行 温度 敏感 装机 未 完成 客户 知道 故障 建议 不要 回访 问题 : . 芯片 扫描仪 温度 敏感 上周 更换 PDPsensor 问题 依旧 问题 : . 芯片 扫描仪 温度 敏感 上周 更换 PDPsensor 问题 依旧 重新 刷写 DOCFLASH 卡后 无法 联机 系统 指示灯 闪 黄灯 DOC 寄给 昂飞 刷写 器 重新 刷写 措施 . 重新 刷写 DOC 设备 启动 报错 SystemError 怀疑 DOC 损坏 . PDPBASEBOARD 未 测试 使用 需要 等待 新 DOC 卡寄到 测试 使用 ,0.6307963611032346
6,重要,客户反馈最近G6PD与tsh实验质控偏低，需上门查看设备。1420最近两次实验G6PD和tsh质控偏低1235维护培训；1420最近两次实验G6PD和tsh质控偏低,客户 反馈 最近 G6PD tsh 实验 质控 偏低 需 上门 查看 设备 1420 最近 两次 实验 G6PD tsh 质控 偏低 1235 维护 培训 1420 最近 两次 实验 G6PD tsh 质控 偏低 ,客户 反馈 最近 G6PD tsh 实验 质控 偏低 需 上门 查看 设备 1420 最近 两次 实验 G6PD tsh 质控 偏低 1235 维护 培训 1420 最近 两次 实验 G6PD tsh 质控 偏低 1235 培训 加样针 管路 清洁 维护 加样 准确度 校准 培训 1420 最近 两次 实验 G6PD tsh 质控 低值 中值 偏低 排查 标准曲线 质控 count 值 没有 明显 偏高 偏低 趋势 G6PD 卤素灯 电压 6.7 V 正常 本次 G6PD 实验 质控 有所 好转 需 观察 后续 实验 情况 tsh 项目 Eu 标定 标液 测试 89 万 偏低 校准 值 100 万 1420 仪器 测试 没有 发现 问题 需 观察 后续 实验 情况 ,0.4975186071310979
7,重要,南通妇幼新装机的扫描仪，DOC问题导致开机异常扫描仪开机自检未通过，两个信号指示灯未亮。问题：扫描仪开机自检未通过，两个信号指示灯未亮。,南通 妇幼 新 装机 扫描仪 DOC 问题 导致 开机 异常 扫描仪 开机自检 未 两个 信号 指示灯 未亮 问题 扫描仪 开机自检 未 两个 信号 指示灯 未亮 ,南通 妇幼 新 装机 扫描仪 DOC 问题 导致 开机 异常 扫描仪 开机自检 未 两个 信号 指示灯 未亮 问题 扫描仪 开机自检 未 两个 信号 指示灯 未亮 措施 . 更换 新 DOC . 开机 测试 正常 ,0.7029470496161664
8,重要,泉州串联筛查量很大，一台设备运行负荷很重，近期响应下降至5-7e6，有时4-5e6；且最近C5DC质控偏高准备进行大的清洗维护保养近期响应下降较多（5-6e6），上次四级杆+碰撞池维护为3月份，同时发现C5DC质控升高，一并进行清洗维护近期响应下降较多（5-6e6），上次四级杆+碰撞池维护为3月份，同时发现C5DC质控升高，一并进行清洗维护,泉州 串联 筛查 量 很大 一台 设备 运行 负荷 重 近期 响应 下降 - 7e6 - 5e6 最近 C5DC 质控 偏高 准备 进行 清洗 维护保养 近期 响应 下降 （ - 6e6 ） 上次 四级 杆 + 碰撞 池 维护 月份 发现 C5DC 质控 升高 一并 进行 清洗 维护 近期 响应 下降 （ - 6e6 ） 上次 四级 杆 + 碰撞 池 维护 月份 发现 C5DC 质控 升高 一并 进行 清洗 维护 ,泉州 串联 筛查 量 很大 一台 设备 运行 负荷 重 近期 响应 下降 - 7e6 - 5e6 最近 C5DC 质控 偏高 准备 进行 清洗 维护保养 近期 响应 下降 （ - 6e6 ） 上次 四级 杆 + 碰撞 池 维护 月份 发现 C5DC 质控 升高 一并 进行 清洗 维护 近期 响应 下降 （ - 6e6 ） 上次 四级 杆 + 碰撞 池 维护 月份 发现 C5DC 质控 升高 一并 进行 清洗 维护 . 进行 碰撞 池 + 四级 杆 + 离子源 + 六级 杆 清洗 . 过夜 抽 真空 达到 极限 真空 使用 PEG 进行 质谱 调谐 峰形 毛刺 更换 新 毛细管 解决 . 进 内标 工作液 调试 采集 参数 变化 不大 . 测试 复溶板 响应 - 8e6 响应 恢复 图形 进入 流速 时 塌陷 超声 毛细管 双通 并重 装 毛细管 图形 恢复 . 测试 新板 样本 响应 9.5 e6 恢复正常 . 清洗 碰撞 池 + 四级 杆 + 离子源 + 六级 杆 甲醇 离子源 六级 杆 第一遍 （ 甲酸 + 甲醇 + 水 ） 均 使用 碰撞 池 超声 二次 甲醇 . 过夜 抽 真空 达到 极限 真空 PEG 调试 发现 峰形 细小 毛刺 很多 更换 新 毛细管 后峰形 恢复 光滑 . Intellistart 几次 均 不能 得到 （ MS1 MS2 低端 分辨率 调 不好 LM 调到 17 调到 16.5 低端 分辨率 过低 ） 最终 调整 autotune 初始 参数 优化 调整 Engineer 参数 得到 MS1 MS2 分辨率 . 进 内标 工作液 调试 采集 参数 变化 均 不大 . 测试 复溶板 响应 - 8e6 响应 恢复 图形 进入 流速 时 塌陷 重装 毛细管 图形 更差 超声 双通 再次 重装 毛细管 图形 恢复 前端 依然 略有 塌陷 . 测试 新板 响应 9.5 e6 正常 ,0.567013266102645
9,重要,新装机的KM1显微镜系统，发现载物台有变形，需要更换更换载物台+图像中心区域偏亮更换载物台+图像中心区域偏亮,新 装机 KM1 显微镜 系统 发现 载物台 变形 需要 更换 更换 载物台 + 图像 中心 区域 偏亮 更换 载物台 + 图像 中心 区域 偏亮 ,新 装机 KM1 显微镜 系统 发现 载物台 变形 需要 更换 更换 载物台 + 图像 中心 区域 偏亮 更换 载物台 + 图像 中心 区域 偏亮 更换 载物台 + 图像 中心 区域 偏亮 . 更换 载物台 运动 测试 正常 . 检查 聚光镜 透光镜 重新 科勒 照明 调整 图像 中心 偏亮 存在 . 调整 检查 灯箱 灯泡 使用 自带 玻片 效果 明显 注 载物台 问题解决 图像 中心 偏亮 问题 存在 需 销售 沟通 处理 等待 协商 ,0.5904528098470428
10,重要,拍出来的图片视野中心偏亮捕获时视野中间偏亮，抠除背景的时候会吧染色体较浅的地方也当背景抠除,拍 图片 视野 中心 偏亮 捕获 时 视野 中间 偏亮 抠 背景 会 染色体 较浅 地方 背景 抠 ,拍 图片 视野 中心 偏亮 捕获 时 视野 中间 偏亮 抠 背景 会 染色体 较浅 地方 背景 抠 . 查看 100 倍镜 下方 视野 图片 屏幕 中间 会 呈现 一个 亮斑 周围 暗 . 查看 聚光镜 柯勒 照明 均 正常 . 更换 三 目镜 进行 检查 情况 完全 解决 . 检查 拍摄 部分 参数 配置 发现 老师 捕获 前 喜欢 伽马 值调 高 导致 明暗 越来越 明显 中间 亮 斑会 影响 捕获 . 询问 老师 之后 得知 当初 培训 告诉 调整 染色体 深浅 需要 调 伽马 值 . 纠正 问题 之后 伽马 值 调低 屏幕 亮度 保持一致 阈值 下面 增强 调出 每次 捕获 手动 调整 染色体 深浅 锐化 程度 捕获 不再 受 影响 . 重新 培训 软件 仪器 使用 ,0.6694534249631026
11,重要,中孕几个样本结果偏低，怀疑没有加样故障：产筛几个样本结果偏低，怀疑没有加样故障：产筛几个样本结果偏低，怀疑没有加样故障处理：1、查看结果，均为2号针加样位置，历史记录无报错信息，怀疑2号针液面探测或者针堵2、进行加样针疏通清洁，2号针与1号针对换3、加样臂清洁，发现2号加样臂焊点松动，重新焊接，2号臂与4号臂对换4、进行加样针准确度测试，通过5、仪器整机清洁消毒,中孕 几个 样本结果 偏低 怀疑 没有 加样 故障 产筛 几个 样本结果 偏低 怀疑 没有 加样 故障 产筛 几个 样本结果 偏低 怀疑 没有 加样 故障 处理 查看 均 号针 加样 位置 历史记录 报错 信息 怀疑 号针 液面 探测 针堵 进行 加样针 疏通 清洁 号针 号 换 加样臂 清洁 发现 号 加样臂 焊点 松动 重新 焊接 号臂 号臂 对换 进行 加样针 准确度 测试 仪器 整机 清洁 消毒 ,中孕 几个 样本结果 偏低 怀疑 没有 加样 故障 产筛 几个 样本结果 偏低 怀疑 没有 加样 故障 产筛 几个 样本结果 偏低 怀疑 没有 加样 故障 处理 查看 均 号针 加样 位置 历史记录 报错 信息 怀疑 号针 液面 探测 针堵 进行 加样针 疏通 清洁 号针 号 换 加样臂 清洁 发现 号 加样臂 焊点 松动 重新 焊接 号臂 号臂 对换 进行 加样针 准确度 测试 仪器 整机 清洁 消毒 故障 处理 查看 均 号针 加样 位置 历史记录 报错 信息 怀疑 号针 液面 探测 针堵 进行 加样针 疏通 清洁 号针 号 换 加样臂 清洁 发现 号 加样臂 焊点 松动 重新 焊接 号臂 号臂 对换 进行 加样针 准确度 测试 仪器 整机 清洁 消毒 ,0.6631055485363688
12,重要,XevoTQD装机后，进行的数据对比发现TQD检测的C8:1，C10:1，C12:1，C14:1空白及样本的浓度检测值均比Xevo高出较多；数据分析显示以上指标升高时间段在5月份之后至今，4月份之前数据显示都还正常，其中3月底进行了阈值参数的修改及离子源的清洗，4月上旬进行过四级杆及碰撞池的清洗，故具体原因还需现场分析,XevoTQD 装机 进行 数据 发现 TQD 检测 C8 : C10 : C12 : C14 : 空白 样本 浓度 检测值 均 Xevo 高出 数据分析 显示 指标 升高 时间段 月份 之后 月份 之前 数据 显示 正常 月底 进行 阈值 参数 修改 离子源 清洗 月 上旬 进行 四级 杆及 碰撞 池 清洗 具体 原因 需 现场 分析 ,XevoTQD 装机 进行 数据 发现 TQD 检测 C8 : C10 : C12 : C14 : 空白 样本 浓度 检测值 均 Xevo 高出 数据分析 显示 指标 升高 时间段 月份 之后 月份 之前 数据 显示 正常 月底 进行 阈值 参数 修改 离子源 清洗 月 上旬 进行 四级 杆及 碰撞 池 清洗 具体 原因 需 现场 分析 . 清洗 离子源 四级 杆 碰撞 池 C8 - C14 : 本底 明显 下降 此前 修改 阈值 参数 关系不大 . 发现 C18 相关 指标 偏高 发现 问题 集中 扎 孔后 新 样本 复溶后 C18 指标 恢复正常 . 测试 发现 扎 孔后 样本 暴露 一段时间 发生 物质 改变 导致 长链 肉碱 离子化 效率 降低 建议 以后 复溶后 测试 样本 扎 孔后 马上 进行 样本 测试 10 . 周四 Xevo 早上 做 完 最后 一块 板 （ 称为 板 B 早上 点 做 完 ） 重新 包被 放到 TQD 上机 MSFile 调用 错误 导致 死机 重新 调用 正确 文件 重置 质谱 上机 测试 进样 量 10ul 响应 （ - ） C8 - 14 : 两台 仪器 检测值 相差 样本 C18 相关 同系物 指标 偏高 很多 大部分 超出 上限 范围 发现 昨晚 测试 复溶板 （ 王宇 周二 复溶 称为 板 A ） 样本 C18 极其 指标 偏高 甲醇 清洗 一遍 锥孔 测试 板 B C18 依旧 偏高 甲酸 / 甲醇 清洗 锥孔 测试 板 B C18 依旧 偏高 测试 xevo 今日 上午 刚 做 完 第一 板 （ 称为 板 C ） 正常 说明 仪器 问题 应为 样本 问题 11 . 修改 两台 仪器 2777cycle 程序 缩短 一块 板 测试 时间 小时 12 . 王彦云 反馈 C18 问题 此前 出现 一次 那次 进样 针扎错 孔后 重新 包被 实验 现象 一致 表现 第三 通道 响应 低 第二 通道 差不多 第一 通道 响应 高 具体表现 C18IS 离子 强度 降低 C18 C18 : 强度 不为 比例 下降 导致 计算 C18 相关 指标 升高 13 . 将板 B 几个 样本 富集 50 号位 XevoTQD 测试 C18 指标 未 表现 偏高 三 通道 二 通道 强度 低 通道 强度 高 9e6 继续 测试 94 孔 C18 依旧 不高 三 通道 二 通道 强度 低 通道 高 50 孔 94 孔移 TQD 测试 上述 表现 一致 进一步 说明 问题 可能 仪器 关系不大 样本 导致 14 . 将板 B 前 两排 重新 复溶 加入 50ul 萃取液 再次 上机 测试 发现 C18 指标 恢复正常 三 通道 强度 恢复 通道 差不多 王彦云 讨论 怀疑 滤膜 纸 污染 样品 导致 撕掉 块 铝箔纸 放入 样品 中 过半 小时 测试 发现 依旧 15 . 晚上 点多 发现 Xevo 今日 测试 完 第二 板 （ 板 D 下午 点半测 完 ） TQD 测试 出现 C18 问题 此板 移到 Xevo 测试 同样 出现 C18 问题 至此 确定 仪器 无关 将板 D 复溶 三个 孔 TQD 测试 C18 问题 恢复正常 16 . 综上 ） 扎过 孔 样本 测试 完后 重新 包被 马上 再次 测试 C18 问题 正常 隔 几个 小时 （ - 4h ） 再测 C18 问题 出现 ） 问题 板 重新 复溶后 C18 问题 正常 ） 复溶后 板子 时间 放置 过长 （ 隔 - 天 ） 会 出现 C18 问题 实验室 基本 不会 南京 妇幼 刚扎 孔后 再行 测试 直接 进行 复溶 测试 确定 扎过 孔 之后 样品 暴露 空气 中 内部 物质 发生 某种 变化 导致 长链 肉碱 离子化 效率 不够 重新加入 新 萃取液 会 消除 此种 变化 ,0.5602478456314287
13,重要,XevoTQD装机后，进行的数据对比发现TQD检测的C8:1，C10:1，C12:1，C14:1空白及样本的浓度检测值均比Xevo高出较多；数据分析显示以上指标升高时间段在5月份之后至今，4月份之前数据显示都还正常，其中3月底进行了阈值参数的修改及离子源的清洗，4月上旬进行过四级杆及碰撞池的清洗，故具体原因还需现场分析,XevoTQD 装机 进行 数据 发现 TQD 检测 C8 : C10 : C12 : C14 : 空白 样本 浓度 检测值 均 Xevo 高出 数据分析 显示 指标 升高 时间段 月份 之后 月份 之前 数据 显示 正常 月底 进行 阈值 参数 修改 离子源 清洗 月 上旬 进行 四级 杆及 碰撞 池 清洗 具体 原因 需 现场 分析 ,"XevoTQD 装机 进行 数据 发现 TQD 检测 C8 : C10 : C12 : C14 : 空白 样本 浓度 检测值 均 Xevo 高出 数据分析 显示 指标 升高 时间段 月份 之后 月份 之前 数据 显示 正常 月底 进行 阈值 参数 修改 离子源 清洗 月 上旬 进行 四级 杆及 碰撞 池 清洗 具体 原因 需 现场 分析 . 清洗 离子源 四级 杆 碰撞 池 C8 - C14 : 本底 明显 下降 此前 修改 阈值 参数 关系不大 . 发现 C18 相关 指标 偏高 发现 问题 集中 扎 孔后 新 样本 复溶后 C18 指标 恢复正常 . 测试 发现 扎 孔后 样本 暴露 一段时间 发生 物质 改变 导致 长链 肉碱 离子化 效率 降低 建议 以后 复溶后 测试 样本 扎 孔后 马上 进行 样本 测试 . 周一 再次 分析 数据 发现 月底 修改 阈值 一个月 - 月份 数据 显示 C8 - C14 : 浓度 值 依然 较为 正常 2016 年 数据 差别 月份 一直 月份 检测值 一直 处于 高水平 确定 修改 阈值 关系不大 （ 找到 确实 时间 月 12 号 仪器 泄 真空 锯 设备 台桌 时间 C8 - C14 : 偏高 ） . 清洗 离子源 六级 杆 使用 磨砂 纸 打磨 离子源 二级 锥孔 一级 锥 孔及 六级 杆 . 正常 程序 超声 清洗 离子源 六级 杆 更换 泵油 抽 真空 . 次日 （ 周二 ） 达到 极限 真空 进 PEG 检查 MS1 MS2 月 26 日刚 进行 质谱 调谐 扫描 检查 发现 月 26 调试 半峰 宽 质量数 差别 不再 进行 Intellistart 调谐 发现 MS1 高端 质量数 左 半边 峰型 鼓包 凸起 现象 发现 调整 HighMassDCBalance - 1.5 高端 质量 峰 趋于 正态分布 形状 MS 峰型 略有 毛刺 调换 顺序 重装 毛细管 尖端 喷雾 散状 更换 新 毛细管 发现 MS 峰型 跳动 断续 现象 再次 更换 回 原来 毛细管 峰型 正常 . 进 内标 工作液 发现 氨基酸 肉碱 锥 孔 电压 原来 - 4v 长链 肉碱 偏小 更 碰撞 能量 变化 不大 . 测试 复溶 样本 响应 大概 - 6e6 C8 - C14 : 检测值 国庆 一定 程度 下降 仍然 Xevo 略 高 修改 阈值 30 , 40 , 50 C8 - C14 : 会 减小 变化 决定 清洗 四级 杆及 碰撞 池 两遍 纯 甲醇 超声 碰撞 池 无尘纸 蘸 甲醇 擦拭 四级 杆 吹干 装回 . 过夜 抽 真空 次日 （ 周三 ） 真空 已到 极限 准备 进行 质谱 调试 蒋 主任 坚持 认为 昨日 维护保养 会 仪器 稳定 建议 观察 一天 周四 进行 室内 质控 测试 是否 存在 RRF 系数 变动 情况 . 先进 PEG 观察 发现 MS1 MS2 质量数 分辨率 均 基本 变化 改变 MS1 DCPolarity 正极 变为 负极 发现 原先 高端 质量数 左 半边 峰型 凸起 状 消失 改变 MS2 负极 变为 正极 增加 半峰 宽 重新 调整 Engineer 界面 参数 Intellistart 调试 MS1 分辨率 0.65 Da MS2 分辨率 0.68 Da9 . 进 内标 工作液 参数 基本 变化 肉碱 碰撞 能量 升高 1ev 测试 Xevo 刚刚 测试 完 样本 响应 不高 - 6e6 C8 - C14 : 浓度 值 明显 下降 昨日 更 低 常州 苏州 TQD 浓度 值 相差 基本 确定 C8 - C14 : 检测值 偏高 仪器 问题 内部 存在 污染 导致 指标 检测 本底 偏高 过夜 测试 昨日 （ 周二 ） 王宇复 溶 第二块 板 （ 称为 板 A ） ",0.6886332333139388
14,重要,120拍摄的照片，部分是模糊的120拍摄图片模糊,120 拍摄 照片 部分 模糊 120 拍摄 图片 模糊 ,120 拍摄 照片 部分 模糊 120 拍摄 图片 模糊 120 拍摄 模糊 . offset 调整 观察 频率 约 10 张 （ 总 60 张片 ） . 清理 检查 z 方向 运动 阻碍 物 . 手动 调节 z 方向 运动 异常 . 镜头 转盘 基座 固定 . 继续 使用 观察 ,0.4485627297869241
15,重要,芯片结果文件无法传输到分析主机,芯片 文件 无法 传输 分析 主机 ,芯片 文件 无法 传输 分析 主机 测试 amds 电脑 能够 ping 通 分析 主机 测试 无法 电脑 登陆 账户 密码 访问 分析 主机 发现 分析 主机 登陆 账户 网络 账户 不同 biosan jianyanke 使用 jianyanke 账户 加 密码 测试 访问 共享 文件夹 应 客户 要求 修改 分析 主机 密码 重新安装 芯片 协议 检查 洗涤 工作站 无漏 液 测试 扫描仪 信号强度 足够 工作 正常 ,0.7358673331068643
16,重要,科室老师反应B做出来的结果荧光值较其他仪器偏高，B仪器维护及性能验证,科室 老师 反应 B 做 荧光值 仪器 偏高 B 仪器维护 性能验证 ,科室 老师 反应 B 做 荧光值 仪器 偏高 B 仪器维护 性能验证 定标 液 测试 Eu 标 128 万 flash1400 + P24 680 下调 580 Eu 标 109 万 清洁 仪器 清洁 导轨 润滑 机械 测试 正常 功能测试 正常 气密性 测试 正常 仪器 测试 正常 之后 荧光值 继续 升高 可能 需要 更换 反馈 滤光片 ,0.4924815960313081
17,重要,120部分拍片模糊，前期已确定是Z轴电机可能存在问题，现尝试更换；z轴异响，且图像模糊z轴异响，且图像模糊,120 部分 拍片 模糊 前期 确定 Z轴电机 可能 存在 问题 现 尝试 更换 z 轴异响 图像 模糊 z 轴异响 图像 模糊 ,120 部分 拍片 模糊 前期 确定 Z轴电机 可能 存在 问题 现 尝试 更换 z 轴异响 图像 模糊 z 轴异响 图像 模糊 . 拆下 检查 z 轴 电机 . 更换 新 z 轴 电机 . 显微镜 完整 校准 调试 . 上片 使用 正常 迷糊 现象 ,0.6896126330827594
18,重要,故障：洗涤工作站2号模块漏液,故障 洗涤 工作站 号 模块 漏液 ,故障 洗涤 工作站 号 模块 漏液 故障 解决 号 模块 号针 位置 固定 模块 螺纹 结晶 严重 导致 更换 针 上方 管路 联动 管路 弯折 闭塞 导致 蠕动泵 管路 接口 脱离 清洁 固定 模块 螺纹 结晶 重新安装 针 整机 接口 进行 结晶 处理 shutdown 测试 正常 ,0.6635412256040071
19,重要,这周连续两次实验取放防蒸发帽报错,周 连续 两次 实验 取放 防蒸发帽 报错 ,周 连续 两次 实验 取放 防蒸发帽 报错 . 检查 历史记录 第一天 实验 显示 自检 时 防蒸发帽 missing retry2 次后 恢复正常 第二次 实验 显示 实验过程 中 掉 防蒸发帽 之前 防蒸发帽 已经 掉落 . 检查 加样枪 坐标 坐标 均 准确 . 检查 防蒸发帽 表面 明显 磨损 使用 加样枪 进行 取放 帽子 测试 - 号 试剂仓 每个 位置 测试 次 均 正常 . 清洁 每个 防蒸发帽 内壁 刷子 清洁 右边 加样枪 金属 头 . 坐标 问题 导致 帽子 掉落 外 可能 帽子 高度 不够 第二次 报错 现实 取到 帽子 后来 不够 紧 掉落 . 每个 试剂盒 中放上 一层 纸板 防蒸发帽 初始 位置 提高 试剂枪 下来 帽子 结合 更 紧 帽子 容易 掉落 . 跟进 一次 实验 实验 分配 试剂 加样 操作 均 正常 ,0.6493418997450641
